mold_name,model_number,release_name,color_description,release_year_start,release_year_end
Missouri Fox Trotter,2016,BreyerFest Live Auction (1 made),,,
Missouri Fox Trotter,2022,BreyerFest Live Auction (1 made),,,
Mule,5609,Mule,black leopard,1998,
Mule,5901,Stablemates 12 Piece Assortment,grey leopard,1999,2000
Mule,5909,"Farm Animals Play Set With Cow, Hen and Chicks, Pig, Mule, Rabbit, Rooster, doll, water trough, corral, fencing, and hay bale.",buckskin,2005,2008
Mule,59197,"Stablemates Little Red Stable Set With Appaloosa, three stall barn that features a tack/storage area, four corral fences, jump, water trough and three race barrels.",black leopard,1999,2001
Mule,410185,"Parade of Breeds II With Appaloosa, Rearing Arabian, Mule, Paso Fino, Scrambling Foal, Scratching Foal, Standardbred, Thoroughbred, Warmblood",chestnut leopard,2005,
Mule,710899,BreyerFest Stablemates Keychain With Clydesdale,glossy metallic gold,1999,
Mule,712249,Finn,glossy rainbow,2018,
Mule,712249,Finn,dun extended blanket,2018,
Mule,2019,Stablemates Collector's Club Raffle prize (1 made),,,
Mule,712249,Finn,shaded grey grulla pinto,2018,
Mule,712249,Finn,glossy shaded chestnut,2018,
Mule,712514,Spooky Surprise Blind Bags Series 5 - Mini Cornelius,glossy with pearlescent candy corn inspired coat,2023,
Mule,790798,"JAH Special Edition Stablemates Gift Set With American Saddlebred, Andalusian, Appaloosa, Rearing Arabian, Clydesdale, Morgan, Mule, Paso Fino, Shetland Pony, Standardbred, Thoroughbred, Warmblood",red dun,1998,
Mule,2007,Mid-States Distributing,,,
Mustang,85,"Diablo, The Mustang","glossy alabaster, grey mane/tail, most with reddish brown eyes, some with black, some with pink shading on the inside of the eyes",1961,1966
Mustang,85,"Diablo, The Mustang","glossy alabaster, grey mane/tail, most with reddish brown eyes, some with pink shading on the inside of the eyes",1961,1966
Mustang,85,"Diablo, The Mustang","glossy alabaster, pink muzzle and genital area, white mane/tail, black eyes",1961,
Mustang,86,"Diablo, The Mustang","glossy grey appaloosa, bald face, white points",1961,1966
Mustang,86,Mustang,"semigloss black, no white markings, black mane/tail",1978,
Mustang,87,"Diablo, The Mustang","matte and semigloss buckskin, bald face, some with dorsal stripe, black points, some with pink nose, eye whites, or solid face",1961,1986
Mustang,87,"Diablo, The Mustang","matte buckskin, bald face, pinkish nose, black points, chalky",,
Mustang,88,"Diablo, The Mustang","glossy charcoal, bald face, white points, some with hand painted eye whites",1961,1970
Mustang,118,American Mustang,"sorrel/palomino, solid face or partially bald face, grey muzzle, flaxen mane/tail, four stockings",1987,1989
Mustang,756,Gawani Pony Boy's Kola,"bay pinto, irregular star/stripe/snip, black points, white chin, white Native American symbols",1999,2002
Mustang,756,Gawani Pony Boy's Kola,"bay pinto, irregular star/stripe/snip, black points, white chin, Native American symbols",1999,2002
Mustang,756,Gawani Pony Boy's Kola,"glossy bay pinto, irregular star/stripe/snip, black points, white chin, Native American symbols",1999,2002
Mustang,828,Paint American Mustang,"bay overo, bald face, pink nose, dorsal stripe, black points",1990,1991
Mustang,896,Rarin' To Go,"grullo, blaze, charcoal-brown points, back, croup, and head, brown ventral band, off hind sock",1994,1995
Mustang,963,"Baron, Mustang","glossy liver chestnut, blaze flanked by charcoal brown shading, black or bi-color eyes, charcoal brown points, off hind sock",1996,1997
Mustang,985,"Diablo, The Mustang","woodgrain, solid face, black eyes, four painted on socks/stockings",1963,1966
Mustang,1085,"Diablo, The Mustang","glossy Copenhagen; dappled blue, bald face, white points,",1963,
Mustang,1162,Bucephalus,"semigloss black, star, eye whites, black mane/tail",2002,2004
Mustang,1296,San Domingo the Medicine Hat Stallion Model and Book Set With a paperback copy of Marguerite Henry's San Domingo The Medicine Hat Stallion.,"chestnut pinto, chestnut medicine hat, shaded muzzle",2007,2008
Mustang,1373,Fun Foals Collector's Event Dapple Grey Stallion,"shaded dapple grey, eye whites, shaded muzzle, knees and hocks, dark and light grey mane/tail",2009,
Mustang,1373G,Fun Foals Collector's Event Glossy Dapple Grey Stallion,"glossy shaded dapple grey, eye whites, shaded muzzle, knees and hocks, dark and light grey mane/tail",2009,
Mustang,1373,Fun Foals Collector's Event Dapple Grey Stallion,"shaded grey, no dapples, eye whites, shaded muzzle, knees and hocks, dark and light grey mane/tail",2009,
Mustang,2085,"Diablo, The Mustang","glossy Florentine; dappled metallic gold, bald face, white points",1963,
Mustang,3085,"Diablo, The Mustang","glossy Gold Charm; solid metallic gold body, bald face, white points",1963,
Mustang,4085,"Diablo, The Mustang","Wedgewood Blue; solid blue body, solid face, white points",1963,
Mustang,10118,Beowulf,"glossy deep red metallic coat, werewolf pattern, glow in the dark",2024,
Mustang,90154,Alvaro,"semigloss sooty buckskin sabino, wide blaze, darker mane, white and dun shaded tail, four stockings",2010,
Mustang,301150,Dillon,"dappled grey blanket, broken blaze to snip, black points, hind sock",2013,
Mustang,410067,Wildfire and Ruby (With San Domingo),"dark red roan, dark chestnut mane/tail, near fore and hind socks,",1988,
Mustang,410184,Fighting Stallions Set With Fighting Stallion,"grullo, apron face, dorsal stripe, darker points, near hind sock",2004,
Mustang,410187,Mustang,"black leopard, pink nose and genitals, light grey mane/tail, knees, and hocks,",1988,
Mustang,410287,Mustang,"matte alabaster, soft grey mane, tail, and nose",1988,
Mustang,410387,Mustang,"bay blanket, bald face, black points. Body color varies from a medium/light sandy or rusty bay to dark chocolate bay.",1988,
Mustang,410487,Mustang,"fleabitten grey, pink nose, dark grey mane/tail",1988,
Mustang,410587,Mustang,"lemony palomino, pink nose, solid face, white mane/tail, four somewhat faint stockings",1988,
Mustang,410592,Turbo the Wonder Horse,"golden palomino, stripe, off fore and hind stockings, white mane/tail, shaded nose, dark hooves",1992,
Mustang,410687,Mustang,"red dun, bald face, pink nose, dark brown mane/tail, dorsal stripe, four stockings",1988,
Mustang,413399,Special Edition Dun Mustang,"red dun, dorsal stripe, darker chestnut points",1999,
Mustang,430040,Semi Rearing Mustang Test Run,"glossy dappled black, smoky shaded pearl grey mane/tail",2019,
Mustang,700796,Merlin,"glossy dark dappled grey or black, bald face, charcoal grey mane/tail, four stockings",1996,
Mustang,701496,Amerigo,"palomino tovero, white head with palomino muzzle, blue eyes, white points, most with pink shading around eyes and groin",1996,
Mustang,1997,Equitana USA Raffle Model (2 made) Signed by designer Ginger Ryals,,,
Mustang,701846,"Warrior, Colonial Spanish Mustang",red dun with yellow Native American symbols,2006,
Mustang,702495,"Rawhide, Wild Appaloosa Mustang","chestnut roan blanket, bald face, dark chestnut points, most with near hind stocking",1995,
Mustang,704118,Frankenstein Horse,"shaded green, blaze, tricolor eyes, black muzzle, mane/tail, grey ""bolts"" at neck, shaded grey lower legs",2008,
Mustang,710300,Sarsparilla,"glossy bay, bald face, black points, four socks",2000,
Mustang,710493,"Wild Horses of America Set With Fighting Stallion, Foundation Stallion","semigloss black, solid face, black mane/tail, near fore sock",1993,
Mustang,710704,Descaro,"glossy bay roan, reddish brown/black points, off fore and near hind socks",2004,
Mustang,711028,Melbourne the Brumby,"buckskin pinto, bald face, pink muzzle, black points, off fore sock",2008,
Mustang,711258,Darjeeling,"glossy bay semi-leopard with brown and black spots, star, snip, black and white mane, black tail with white tip, black lower legs, off hind sock",2017,
Mustang,711258,Darjeeling,"glossy bay semi-leopard with brown spots, solid face, black and white mane, black tail with white tip, black lower legs, off hind sock",2017,
Mustang,712103,Diablo,"red roan, pink muzzle, darker mane/tail",2014,
Mustang,712151,My Kind of Town,chocolate dun,2015,
Mustang,712244,Tanner,black pinto with war paint,2018,
Mustang,712359,Bellevue,"chalky light dapple grey, darker grey mane/tail and knees",2020,
Mustang,720198,Renegade,"semigloss black overo, white face, near fore sock",1998,
Mustang,907002,Back to School San Domingo With San Domingo the Medicine Hat Stallion paperback book.,"chestnut pinto, chestnut medicine hat, shaded muzzle",2007,
Mustang,1987,Test Run (~10 believed made),,,
Mustang,1994,BreyerFest Live Auction (1 made),,,
Mustang,1995,BreyerFest Live Auction Model shown is from the Black Horse Ranch Model Horse Collection,,,
Mustang,1996,BreyerFest Live Auction (1 made),,,
Mustang,1998,BreyerFest Live Auction (1 made) With Certificate of Authenticity,,,
Mustang,2001,BreyerFest Live Auction (1 made) With Certificate of Authenticity.,,,
Mustang,2002,"QVC With hang tag, informational certificate",,,
Mustang,2003,BreyerFest Live Auction (1 made),,,
Mustang,2006,BreyerFest Live Auction (1 made),,,
Mustang,2009,BreyerFest Live Auction (1 made),,,
Mustang,2009,Lone Star Experience (4 made),,,
Mustang,2010,BreyerFest Live Auction (1 made),,,
Mustang,2014,BreyerFest Live Auction (1 made),,,
Mustang,2015,BreyerFest Silent Auction (1 made) With Certificate of Authenticity,,,
Mustang,2018,BreyerWest Silent Auction (1 made) With Certificate of Authenticity. Same pattern as Kick Up Your Heels.,,,
Mustang,2019,BreyerFest Live Auction (1 made) With Certificate of Authenticity,,,
Mustang,2021,BreyerFest Live Auction (1 made) With Certificate of Authenticity,,,
Mustang,2023,"BreyerFest Live Auction (1 made, sold for $9,000) With Certificate of Authenticity",,,
Native Dancer,5023,Native Dancer,"steel gray, solid face, black or dark grey mane/tail, various stockings",1976,1994
Native Dancer,5178,Appaloosa,"red bay blanket, solid face, black points",1995,1997
Native Dancer,5311,"Spirit: Stallion of the Cimarron Play Set With Rearing Arabian, tree, a blacksmith and a forge fire, hitching post. (Replaced by Appaloosa)","steel grey with ""US"" brand on shoulder",2005,
Native Dancer,5650,"Saddle Club Stablemates Collection With Arabian Mare, Citation, Native Dancer, Silky Sullivan, Swaps","chestnut tobiano. blaze, chestnut and white mane/tail, high stockings",1995,1997
Native Dancer,5651,"Stablemates Collection With Arabian Mare, Citation, Native Dancer, Silky Sullivan, Swaps.","chestnut tobiano. blaze, chestnut and white mane/tail, high stockings",1998,
Native Dancer,495091,"Stablemates Assortment III With Arabian Mare, Arabian Stallion, Citation, Draft Horse, Morgan Mare, Morgan Stallion, Native Dancer, Seabiscuit, Silky Sullivan, Swaps, Thoroughbred Mare.","palomino, solid face, white mane/tail with some overspray, hind stockings",1991,
Native Dancer,495092,"Stablemates Assortment IV With Arabian Mare, Arabian Stallion, Citation, Draft Horse, Morgan Mare, Morgan Stallion, Native Dancer, Quarter Horse Stallion, Seabiscuit, Silky Sullivan, Swaps.","black, black mane/tail, near hind stocking",1992,
Native Dancer,495600,"Stablemates Assortment With Arabian Mare, Arabian Stallion, Citation, Draft Horse, Morgan Mare, Morgan Stallion, Native Dancer, Saddlebred, Seabiscuit, Silky Sullivan, Swaps, Thoroughbred Mare","red bay, solid face, black points",1989,
Native Dancer,495601,"Stablemates Assortment II With Arabian Mare, Arabian Stallion, Citation, Draft Horse, Morgan Mare, Morgan Stallion, Native Dancer, Seabiscuit, Silky Sullivan, Swaps, Thoroughbred Mare","white, solid face, charcoal/black points",1990,
Native Dancer,710695,"Set of 12 Miniatures With Arabian Mare, Arabian Stallion, Citation, Morgan Mare, Morgan Stallion, Native Dancer, Quarter Horse Stallion, Silky Sullivan, Swaps, Thoroughbred Mare.","bay, solid face, black points, near fore and hind stockings",1995,
Native Dancer,711094,"12-Piece Stablemates Set With Arabian Mare, Arabian Stallion, Citation, Draft Horse, Morgan Mare, Morgan Stallion, Native Dancer, Quarter Horse Stallion, Seabiscuit, Silky Sullivan, Swaps.","black, black mane/tail, near hind stocking",1994,
Native Dancer,711096,"12-Piece Stablemates Set With Arabian Mare, Arabian Stallion, Citation, Draft Horse, Morgan Mare, Morgan Stallion, Native Dancer, Quarter Horse Stallion, Saddlebred, Seabiscuit, Silky Sullivan, Swaps.","red dun, bald or solid face, darker chestnut points",1996,
Native Dancer,712327,Gold Charm Secretariat,"gold charm, blaze, three socks, not near fore",2020,
Native Dancer,2025,"Vintage Collectors Club (1,200 made)",,,
Native Dancer,1994,BreyerFest Live Auction (1 made),,,
Native Dancer,1998,JCPenney Holiday Catalog,,,
Norwegian Fjord Stallion,90199,Lyric,silver bay splash white,2020,
Norwegian Fjord Stallion,711397,Avant Garde,"purple dun, white mane/tail, four socks",2021,
Norwegian Fjord Stallion,712437,Atli,chestnut,2022,
Norwegian Fjord Stallion,712437,Atli,rose grey,2022,
Norwegian Fjord Stallion,712437,Atli,silver bay,2022,
Norwegian Fjord Stallion,712437,Atli,resist dapple pastel rainbow,2022,
Norwegian Fjord Stallion,2025,"Inspired by 2015 Contest Prize model ""Truffles""",,,
Norwegian Fjord Stallion,2025,"Gamblers choice between 4 colors with a chance at receiving one of 75 glossy solid black ""Coal"". Done as a ""mini"" version of the 2019 ""Christmas Candy"" zebra santa surprise releases. - Candied Red - Satin Green - Metallic Gold - Shimmery Blue - Coal",,,
Norwegian Fjord Stallion,2025,"(75 made)Gamblers choice between 4 colors with a chance at receiving one of 75 glossy solid black ""Coal"". Done as a ""mini"" version of the 2019 ""Christmas Candy"" zebra santa surprise releases. - Candied Red - Satin Green - Metallic Gold - Shimmery Blue - Coal",,,
Paso Fino,10058,Gascon the Great,light grey,2024,
Paso Fino,90209,Canción,"dappled flaxen chestnut, blaze, two stockings, one sock",2023,
Paso Fino,90209,Canción On base,"dappled flaxen chestnut, blaze, two stockings, one sock",2023,
Paso Fino,90209G,Canción,"glossy dappled flaxen chestnut, blaze, two stockings, one sock",2023,
Paso Fino,711634,Hippodrome,bay varnish pintaloosa,2023,
Paso Fino,2023,Test piece given to Jennifer Scott (1 made),,,
Paso Fino,2024,"BreyerFest Live Auction Model (1 made) (Sold for 8,000$) With Certificate of Authenticity.",,,
Peruvian Paso,576,Peruvian Paso,"dapple grey, lighter face, shaded body, light grey to black mane/tail, shaded knees and hocks",2002,2004
Peruvian Paso,1223,"El Caballo Peruano de Paso The Horse from the Land of the Incas With rider, leather saddle and bridle","palomino, blaze and snip, shaded muzzle, white mane/tail, four stockings",2004,
Peruvian Paso,1223,El Caballo Peruano de Paso The Horse from the Land of the Incas,,,
Peruvian Paso,1358,Manco Capac,"red roan, blaze, snip, darker head, darker red points, three socks, not off fore",2010,
Peruvian Paso,1358G,Manco Capac,"glossy red roan, blaze, snip, darker head, darker red points, three socks, not off fore",2010,
Peruvian Paso,1709,RCH Ventarrones,"semigloss dark mahogany bay, star, black points, four socks",2014,2015
Peruvian Paso,1709G,Glossy RCH Ventarrones,"glossy dark mahogany bay, star, black points, four socks",2014,
Peruvian Paso,1878,Baranco,shaded bay,2023,
Peruvian Paso,90127,Del Fuego,"liver chestnut, shaded muzzle, flaxen mane/tail",2004,
Peruvian Paso,430040,Peruvian Paso Test Run,pearly slate grullo,2017,
Peruvian Paso,701113,Causin' A Commotion,"buckskin, black muzzle and points, shaded groin",2003,
Peruvian Paso,710102,RSV Inolvidable,"dark glossy mahogany bay, black points",2002,
Peruvian Paso,710914,Cobrizo,"metallic bay, black points, near fore coronet",2004,
Peruvian Paso,711306,Magnifico,"dark chestnut, flaxen mane/tail, hind socks",2006,
Peruvian Paso,711477,Gran Cavallo,mahogany liver chestnut sabino,2021,
Peruvian Paso,711477,Gran Cavallo,blue/purple colorshift sabino,2021,
Peruvian Paso,712028,Bluebonnet,silver grullo,2009,
Peruvian Paso,2025,"Exotic Destinations Series (600 made)""Machu Pichu 2025"" stamped on belly7th in series",,,
Peruvian Paso,2002,BreyerFest Live Auction (1 made),,,
Peruvian Paso,2003,BreyerFest Live Auction (1 made),,,
Peruvian Paso,2005,BreyerFest Live Show prize (4 made),,,
Peruvian Paso,2006,BreyerFest Early Bird Raffle (1 made) With Certificate of Authenticity,,,
Peruvian Paso,2006,BreyerFest Live Auction (1 made),,,
Peruvian Paso,2010,BreyerFest Live Auction (1 made),,,
Peruvian Paso,2011,BreyerFest Live Auction (1 made),,,
Playful Foal,5549,"Mystery Unicorn Foal Surprise - Citrus Valley With Morgan, Draft Foal, Connemara Mare",metallic light pink w/ gold horn and hooves,2023,
Playful Foal,2020-2021,"Breyer's website lists this as #6064, box reads #6052.",,,
Playful Foal,6936,"Colorful Collection Gift Set With Stock Horse Mare, Morgan, Friesian, Playful Foal, Cantering Foal, Indian Pony, Warmblood Mare, Gypsy Vanner",palomino,2023,
Playful Foal,10060,"Mystery Foal Surprise - Peaceful Gardens With Giorgio, Belgian, Playful Foal",black tobiano,2024,
Playful Foal,712402,Leti With Frisky Foal,glossy bay sabino,2021,
Playful Foal,880081,"Mystery Unicorn Foal Surprise - Windswept With Magnolia, Morgan","green, gold horn and hooves",2021,
Prince Charming,4261,Unicorn Surprise Paint & Play,unpainted,2021,2024
Prince Charming,6056,Mystery Unicorn Surprise Series Two,pink,2021,2024
Prince Charming,6056,Mystery Unicorn Surprise Series Two,yellow,2021,2024
Prince Charming,6912,"Unicorn Swirl Gift Set - Dreamcicle With Connemara Mare, Clydesdale, Warmblood Mare",orange and marigold swirl,2022,
Prince Charming,6937,"Sparkling Splendor Unicorn Set With Connemara Mare, Frisky Foal, Fireheart, Magnolia, Standing Foal, Walking Thoroughbred, Warmblood Mare",metallic gold w/ gold horn and hooves,2023,2025
Prince Charming,10073,"Mystery Unicorn Foal Surprise - Enchanted Forest With Kit, Prince Charming, Standing Foal",metallic lavender purple w/ gold horn and hooves,2024,
Prince Charming,10101,Suddenly I Was A Lilac Sky,glossy pearly violet filigree,2024,
Prince Charming,97268,Unicorn Crazy Surprise Series 4,black with gold dappling,2020,
Prince Charming,301173,"Mystery Unicorn Foal Surprise - Seascape With Alborozo, Standing Foal",purple overo,2022,
Prince Charming,711522,"Linzer Best of BreyerFest Series 3 With Cantering Warmblood, Connemara Mare, Walking Thoroughbred, Mustang",bay tobiano,2022,
Prince Charming,712434,Phineas,dapple rose grey,2022,
Prince Charming,781154,Mystery Horse Surprise Series 3,blue filigree,2021,
Prince Charming,880081,"Mystery Unicorn Foal Surprise - Enchanted With Walking Thoroughbred, Standing Foal",pearly amethyst w/ gold horn and hooves,2021,
Prince Charming,10248,Atlanta: Standardbred Superstar,"Bay, ""9N527"" freezebrand right side of neck, star, half pastern on left rear leg.",2025,
Proud Arabian Mare,8,Arabian Mare Pride (Old Mold),"glossy alabaster, grey mane/tail and muzzle",1958,1959
Proud Arabian Mare,8,Arabian Mare Pride (Old Mold),"glossy alabaster, grey mane/tail, pink muzzle, grey nostrils",1958,1959
Proud Arabian Mare,10,Pride and Joy With Proud Arabian Foal,"glossy alabaster, grey mane/tail and muzzle",1958,1959
Proud Arabian Mare,11,"Prince, Pride, and Joy With Family Arabian Stallion, Proud Arabian Foal","glossy alabaster, grey mane/tail and muzzle",1958,1959
Proud Arabian Mare,12,Prince and Pride With Family Arabian Stallion,"glossy alabaster, grey mane/tail and muzzle",1958,1959
Proud Arabian Mare,14,"Sheba, Arabian Mare (Old Mold)","glossy bay, short blaze, black or charcoal-brown mane/tail, no black on legs, four stockings",1956,1959
Proud Arabian Mare,14,"Sheba, Arabian Mare (Old Mold)","glossy bay, short blaze, black or charcoal-brown mane/tail, no black on legs, four stockings, chalky",1956,1959
Proud Arabian Mare,16,"""Sheik"" ""Sheba"" and ""Shah"" With Family Arabian Stallion, Proud Arabian Mare, Proud Arabian Foal","glossy bay, short blaze, black or charcoal-brown mane/tail, no black on legs, four stockings",1958,1959
Proud Arabian Mare,17,"""Sheba"" and ""Shah"" With Proud Arabian Mare, Proud Arabian Foal","glossy bay, short blaze, black or charcoal-brown mane/tail, no black on legs, four stockings",1958,1959
Proud Arabian Mare,38,"Appaloosa Mare, Speck (Old Mold)","glossy grey blanket, bald face, pink nose, black mane/tail, grey legs",1959,1959
Proud Arabian Mare,215,Proud Arabian Mare,"matte or semigloss dapple grey, no or few dapples on head and neck, most with bald or light grey face, grey mane/tail, fore stockings, soft grey hind legs",1972,1975
Proud Arabian Mare,215,Proud Arabian Mare,"matte dapple grey, no or few dapples on head and neck, most with bald or light grey face, grey mane/tail, four stockings",1976,1979
Proud Arabian Mare,215,Proud Arabian Mare,"semigloss dapple grey, no or few dapples on head and neck, most with bald or light grey face, grey mane/tail, four stockings",1976,1979
Proud Arabian Mare,215,Proud Arabian Mare,"dapple grey, no or few dapples on head and neck, most with bald or light grey face, grey mane/tail, four stockings, chalky",1976,1979
Proud Arabian Mare,215,Proud Arabian Mare,"matte or semigloss dapple grey with dapples on head and neck, most with bald or light grey face, light grey lower legs or four stockings",1985,1986
Proud Arabian Mare,215,Proud Arabian Mare,"matte dapple grey with dapples on head and neck, most with bald or light grey face, light grey lower legs or four stockings",1985,1986
Proud Arabian Mare,215,Proud Arabian Mare,,,
Proud Arabian Mare,215,Proud Arabian Mare,"matte or semigloss dapple grey, dapples on head and neck, most with bald or light grey face, black mane/tail, black or grey legs",1982,1984
Proud Arabian Mare,215,Proud Arabian Mare,"matte and semigloss soft medium dapple grey, no dapples on head or neck, slightly darker grey mane/tail, dark-shaded knees and hocks, four stockings",1987,1988
Proud Arabian Mare,216,Proud Arabian Mare,"glossy mahogany bay, solid face, black points, various stockings",1972,1980
Proud Arabian Mare,216,Proud Arabian Mare,"semigloss mahogany bay, solid face, black points, various stockings",1972,1980
Proud Arabian Mare,216,Proud Arabian Mare,"matte mahogany bay, solid face, black points, various stockings",1972,1980
Proud Arabian Mare,216,Proud Arabian Mare,"golden mahogany bay, solid face, black points, various stockings",1972,1980
Proud Arabian Mare,216,Proud Arabian Mare,"mahogany bay, solid face, black points, various stockings",1972,1980
Proud Arabian Mare,216,Proud Arabian Mare,"mahogany bay, solid face, black points, various stockings, chalky",,
Proud Arabian Mare,217,Proud Arabian Mare,"most matte, some semigloss alabaster, grey mane/tail",1972,1976
Proud Arabian Mare,217,Proud Arabian Mare,"alabaster, grey mane/tail, chalky",,
Proud Arabian Mare,805,Proud Arabian Mare,"semigloss dappled rose grey, solid face, darker rose grey mane/tail, knees hocks and muzzle",1989,1990
Proud Arabian Mare,840,Proud Arabian Mare,"slightly semigloss red chestnut, solid face with pale area over nose, lighter chestnut mane/tail, four stockings",1991,1992
Proud Arabian Mare,908,Arabian Mare (Old Mold),"woodgrain, black eyes, no white markings",1959,
Proud Arabian Mare,948,"Karma Gypsy, Pinto Half-Arab","dark bay tobiano, snip extending above nose, black or bi-color eyes, white mane, black forelock and tail, hind socks",1996,1998
Proud Arabian Mare,1128,Carinosa Arabian Hall of Famer,"light shaded chestnut, dark shaded face, lighter chestnut mane/tail, off hind sock",2001,
Proud Arabian Mare,2155,"Proud Arabian Mare Gift Set With blue/white halter, carrying case.","matte or semigloss dapple grey, no or few dapples on head and neck, most with bald or light grey face, grey mane/tail, fore stockings, soft grey hind legs",1972,1973
Proud Arabian Mare,2165,"Proud Arabian Mare Gift Set With red/white halter, carrying case.","mahogany bay, solid face, black points, various stockings",1972,1973
Proud Arabian Mare,2168,Mahogany Bay Proud Arabian Mare With English Saddle,"mahogany bay, solid face, black points, various stockings",1976,1977
Proud Arabian Mare,2175,"Proud Arabian Mare Gift Set With green/white halter, carrying case.","most matte, some semigloss alabaster, grey mane/tail",1972,1973
Proud Arabian Mare,400393,Steel Dust,"pale shaded smoke grey, bald face, dark grey points, off hind stocking",1994,
Proud Arabian Mare,410293,Proud Arabian Mare,"glossy silver filigree, bald face, white points",1993,
Proud Arabian Mare,490196,Spotted Legacy Gift Set With Proud Arabian Foal,"chestnut tobiano, solid face, darker chestnut mane/tail, four stockings",1996,1997
Proud Arabian Mare,492091,"Arabian Horses of the World Set With Family Arabian Stallion, Proud Arabian Stallion","fleabitten rose grey, darker grey points",1991,1992
Proud Arabian Mare,492091,"Arabian Horses of the World Set With Family Arabian Stallion, Proud Arabian Stallion","fleabitten rose grey, lighter grey points than above",1991,1992
Proud Arabian Mare,497679,Arabian Mare and Foal Set With Proud Arabian Foal,"red bay overo, solid face, black points, near hind sock",1988,
Proud Arabian Mare,703002,Banat Er Rih,"shaded rose grey, narrow stripe and snip, shaded muzzle, black or dark grey points, hind socks, dorsal stripe",2002,
Proud Arabian Mare,703002,Banat Er Rih,,,
Proud Arabian Mare,705495,"Parade of Breeds With Cantering Welsh Pony, Saddlebred Weanling","sandy bay, solid face, black points, off hind sock",1995,
Proud Arabian Mare,711289,Sierra Rose,matte dappled rose grey,2018,
Proud Arabian Mare,711289,Sierra Rose,glossy dappled rose grey,2018,
Proud Arabian Mare,711523,Lorelei,clear crystal,2022,
Proud Arabian Mare,712015,Celebrity,"glossy shaded chestnut, flaxen mane/tail, near fore and off hind socks",2008,
Proud Arabian Mare,712084,La Jolla,"dapple grey, bi-color eyes, shaded muzzle, grey mane/tail, black legs",2012,
Proud Arabian Mare,712144,Farah,"glossy palomino overo, bald face, white mane/tail, four stockings",2015,
