mold_name,model_number,release_name,color_description,release_year_start,release_year_end
Andalusian,2024-2025,Grape Scented,,,
Andalusian,11041,Truffle,grey,2024,2025
Arabian,7862,Whisper,grey,2023,2024
Arabian,7866,Celeste,"purple w/ darker points, mane and tail, silver horn and hooves with glitter",2023,2024
Arabian,7880,Cinnamon,flaxen liver chestnut,2023,2024
Arabian,10021,Chili,"chestnut, stocking (right front)",2024,2025
Arabian,11042,Mara,"pink w/ darker points, mane and tail, gold horn and hooves with glitter",2024,2025
Black Beauty,89,Black Beauty,"black, star, black mane/tail four stockings",1979,1980
Black Beauty,89,Black Beauty,"black, right hind stocking",1981,
Black Beauty,89,Black Beauty,"black, right fore stocking",1982,1988
Black Beauty,722,Sir Wrangler,"bay semi-leopard, star and stripe, black points, hind stockings",1998,1999
Black Beauty,802,Fade to Gray,"slightly semi-gloss dark dapple grey, stripe, charcoal mane/tail",1989,1990
Black Beauty,833,Dream Weaver,"sorrel, flaxen mane/tail, blaze down muzzle and chin, off side stockings",1991,
Black Beauty,919,Donovan Running Appaloosa Stallion,"grey dun roan blanket, dappled or bald lower face, splashed on chestnut spots, black spots, near fore and hind stockings",1995,1997
Black Beauty,1139,AA Omner,"fleabitten grey, grey shaded muzzle, grey speckles",2001,2002
Black Beauty,1219,"Riata Ranch Trick Riding Set With trick riding tack set, doll, and American flag","chestnut pinto, bi-colored mane, light chestnut tail",2003,2004
Black Beauty,1226,The Midnight Ride of Paul Revere With English tack and Paul Revere doll,"shaded bay, black points, off fore sock, broken stripe",2005,
Black Beauty,1269,Flicka,"black, metallic undercoat, eye whites",2006,2007
Black Beauty,1360,Ben Cartwright's Buck,"shaded buckskin, black points, bi-colored eyes",2009,2011
Black Beauty,1360,Ben Cartwright's Buck,"glossy shaded buckskin, black points, bi-colored eyes",2010,
Black Beauty,301157,Lakota,"palomino, white mane/tail, four stockings",2017,
Black Beauty,410802,"Zorion & Orion, Magical Unicorn Set With Action Stock Horse Foal","iridescent white, pinkish shading",2002,
Black Beauty,430054,Sport Horse,"flaxen liver chestnut, star, snip",2022,
Black Beauty,701897,Talisman or Fairbanks,"dappled bay, solid face, belly and chest lighter and redder than the body, near fore and off hind stockings",1997,
Black Beauty,1979,Sears Holiday Catalog Same as #89,,,
Black Beauty,1984,"Sears Holiday Catalog. Additional models rumored to have been exported to a British dealer, but this appears to be incorrect",,,
Black Beauty,1980,"Just About Horses VII #3, 1980",,,
Black Beauty,1989,Sears Holiday Catalog Same as #802,,,
Black Beauty,1991,BreyerFest Live Auction (1 made) With Letter of Authenticity. Model is from the Black Horse Ranch collection.,,,
Black Stallion,401,Walter Farley's Black Stallion,"glossy black, no white markings, black mane/tail, tan hooves",1981,1988
Black Stallion,401,Walter Farley's Black Stallion,"glossy black, no white markings, black mane/tail, black hooves",1981,1988
Black Stallion,811,Majestic Arabian Stallion,"leopard appaloosa, white with black and brown splattered spots, black points",1989,1990
Black Stallion,832,"Hyksos, the Egyptian Arabian","glossy ageless bronze, solid face, bicolor eyes, at least one with chocolate brown mane/tail",1991,
Black Stallion,899,Greystreak Action Arabian,"shaded smoke grey, solid pale grey face, black points, near foreleg and off hind leg stockings",1994,1995
Black Stallion,905,Princess of Arabia,"body medium grey to nearly white, light dappled grey, white mane/tail with grey shading, stockings with grey fetlocks",1995,
Black Stallion,905,Princess of Arabia,"red roan, pale tan with red flecks, chestnut mane/tail and leg joints,",1995,
Black Stallion,983,"Equus, Arabian Race Horse and Equus Magazine Namesake","painted-on alabaster, shaded muzzle and sides of face, mane/tail, knees, hocks, pink and white stenciled snip, most with grey inner ears, some with pink",1997,1998
Black Stallion,1281,"Jingles of Pegasus Therapeutic Riding, Inc.","chestnut, white muzzle, hind stockings",2006,
Black Stallion,1413,Mystical Unicorn,"dappled lavender/grey, shaded muzzle, tail tip, knees",2010,2012
Black Stallion,2095,"The Black Stallion, Book and Poster Set","semigloss or matte black, no white markings, black mane/tail, tan hooves",1981,1983
Black Stallion,3000,"Black Stallion and Alex Set With doll, racing silks, saddle and bridle","semigloss or matte black, no white markings, black mane/tail, tan hooves",1982,1985
Black Stallion,430040,Chestnut Arabian Test Piece,"flaxen liver chestnut, snip, four stockings, tan hooves",2018,
Black Stallion,700694,"Ofir, Sire of Witez II","dark plum bay, star or snip, black points, four stockings",1994,
Black Stallion,704195,Greystreak Action Arabian,"shaded smoke grey, solid pale grey face, black points, near foreleg and off hind leg stockings",1995,
Black Stallion,705196,Sapphire,"buckskin, solid face, black points, near foreleg and hind leg stockings",1996,
Black Stallion,713259,English Horse Collector's Set With Justin Morgan and Indian Pony,"light coffee bay, solid face, black points",1988,
Black Stallion,2025,"Vintage Collectors Club (1,200 made) ""Vintage Collector Club 2025"" stamp on belly. Came with Certificate of Authenticity and booklet featuring the history and significance of model.",,,
Black Stallion,1982,JCPenney Holiday Catalog Same as or similar to #3000,,,
Black Stallion,1989,Sears Holiday Catalog Same as #811,,,
Black Stallion,2021,Test Piece Raffle Model (1 made) With Certificate of Authenticity,,,
Black Stallion,1990,BreyerFest Live Auction (1 made),,,
Black Stallion,1994,BreyerFest Live Auction (1 made),,,
Black Stallion,1997,BreyerFest Live Auction (1 made) With Certificate of Authenticity,,,
Bucking Bronco,190,Bucking Bronco,"black, bald face, black mane/tail, four stockings",1966,1973
Bucking Bronco,191,Bucking Bronco,"steel grey, bald face, darker grey mane/tail, four stockings",1961,1967
Bucking Bronco,192,Bucking Bronco,"bay, bald face, black mane/tail, four stockings",1967,1970
Bucking Bronco,730,Bucking Bronco,rose dun,1998,
Bucking Bronco,932,Dakota Bucking Bronco,"palomino with resist dappling, bald face, white mane/tail, hind stockings",1995,1996
Bucking Bronco,6001,Bucking Bronco with Cinch With bareback rigging,blue roan overo,2000,
Bucking Bronco,6012,"Bucking Bronco Set With cowboy rider, bareback rigging and cinch.",blue roan overo,2001,2005
Bucking Bronco,8165,Aries,"glossy palomino, lighter mane, darker tail, four stockings, zodiac symbols in yellow on both hips",2015,
Bucking Bronco,8928,Bucking Bronco,red roan,1996,
Bucking Bronco,300322,Outlaw and Amigo With American Quarter Horse Foal,red dun pinto,2013,
Bucking Bronco,411190,Bucking Bronco,red roan,1988,
Bucking Bronco,412190,Bucking Bronco,red dun,1988,
Bucking Bronco,413190,Bucking Bronco,black leopard,1988,
Bucking Bronco,414190,Bucking Bronco,grey,1988,
Bucking Bronco,701092,Show Special,black overo,1992,
Bucking Bronco,711173,Rock-A-Billy,blue decorative western pattern,2013,
Bucking Bronco,711175,Headspin,buckskin with western deco pattern,2013,
Bucking Bronco,750104,"Tornado, Blue Roan Mustang and Fiesta the Cougar With Cougar",blue roan overo,2004,
Bucking Bronco,750206,"Notaxe, Bay Bronco and Adohi, Cougar With Cougar",light bay,2007,
Bucking Bronco,750213,"Comet, Grey Bucking Stallion, with Rogue, Grey Wolf With Wolf","light grey, dark grey mane/tail, knees, hocks",2008,
Bucking Bronco,1995,BreyerFest Live Auction (1 made) Signed by Peter Stone on belly,,,
Charging Mesteño,4812,The Progeny - Gift Set Mesteño and His Yearling With Rojo,dark dun,1995,
Charging Mesteño,300362,America's Wild Mustangs With American QH Foal,chestnut leopard,2018,
Charging Mesteño,702995,The Progeny - Gift Set Mesteño and His Yearling With Rojo,dark dun,1995,
Charging Mesteño,750146,"Ventoso, Rose Grey Stallion and Roca, Chestnut Foal With Mesteño the Foal",rose grey,2005,
Charging Mesteño,750215,"Rain Dancer, Buckskin Stallion, and Magic, Buckskin Foal With Morgan Foal",buckskin,2008,
Charging Mesteño,751203,Zephyr and Sundance Grullo Charging Mustang with Dun Foal With Mustang Foal,grullo,2003,
Duchess,663,Thoroughbred Cross,buckskin,2006,2008
Duchess,1391,"Cloud's Legacy With Black Beauty, Trotting Stock Horse Foal, Warmblood Foal",red roan,2009,
Duchess,1391,"Cloud: Challenge of the Stallions With Black Beauty, Trotting Stock Horse Foal, and Warmblood Foal",red roan,2010,2014
Duchess,3040,"Black Beauty Family With Black Beauty, Ginger, Merrylegs",bay,1980,1993
Duchess,3345,"King of the Wind Set With Black Beauty, Black Stallion",alabaster,1990,1993
Duchess,3347,"Trakehner Family With Jet Run, Mustang Foal",light dappled grey,1992,1994
Duchess,4111,"Model Horse Play Set and Activity Kit With materials to make a halter, lead rope, and several blankets that can be customized with colorful patches.",dapple grey,2004,2007
Duchess,6136,Wild Blue With paperback book,blue roan,2009,
Duchess,8171,Libra,"glossy shaded light blue, white lower face, pink muzzle, whitish blue mane/tail, four stockings, white zodiac symbols on both hips",2015,
Duchess,8902,Duchess,bay,1996,
Duchess,19843,"Surrey to Church on Sunday With Jet Run, surrey and harness, ceramic dolls, wood base and clear display case",flocked bay,1984,1987
Duchess,61017,"Veterinary Care Gift Set With veterinarian doll, first aid kit, stethoscope, vet bag, preventative medicine tub, ointment and syringe.",buckskin roan,2007,2009
Duchess,61070,Western Horse and Rider,"red roan, blaze, snip, hind socks",2014,2017
Duchess,61101,"Stevie and Belle Gift Set Saddle Club With doll, English tack, saddle pad",black,2009,2011
Duchess,61102,"Lisa and Prancer Gift Set Saddle Club With doll, English tack, saddle pad",chestnut,2008,2011
Duchess,61116,Classics Western Horse & Rider,"sorrel, flaxen mane/tail, hind stockings",2017,2022
Duchess,62005,"Appaloosa Mare and Dun Foal With Arabian Foal (2005) Andalusian Foal (2006-2007), Morgan Foal (2008)",buckskin blanket,2005,2008
Duchess,62006,Pinto Horse and Foal - Chestnut With Trotting Stock Horse Foal,chestnut pinto,2010,
Duchess,62031,Grey Thoroughbred & Dark Grey Foal With Morgan Foal,light grey,2010,2013
Duchess,300311,"Bonanza Four Piece Classics Set With Black Beauty, Ruffian, Warmblood Stallion",dark bay,2009,
Duchess,300362,America's Wild Mustangs With Morgan Foal,"palomino, white points",2019,
Duchess,711246,"Tschiffely's Ride Gato and Mancha With Duchess, Stock Horse Gelding","red and white piebald, black mane/tail",2016,
Duchess,720037,"Let's Go Camping With doll, Beagle, camping accessories.",dark bay tobiano,2007,
Duchess,720601,"Wildlife Adventure With blanket, rider doll, baby gorilla",chestnut blanket,2009,
Duchess,750036,"Cheyenne, Chestnut Pinto Mare and Diego, Black Wolf With Wolf",chestnut pinto,2004,2006
Duchess,750202,Sacred Medicine Hat Stallion with Gray Wolf With Wolf,chestnut pinto,2003,
Duchess,750207,"Bee'Xooti Chestnut Mare & Nookuhene Bay Pinto Foal With Ginger or Duchess, Morgan Foal",chestnut,2008,2009
Duchess,750210,"Gold Dust, Palomino Mare and Sagebrush, Liver Chestnut Appaloosa Foal With Rojo",palomino/light chestnut,2008,
Duchess,750302,Alano and Mateo With Rojo. Replaced Mesteño.,chestnut,2003,
Duchess,750906,"Dreamer Gift Set ""Sonador"" With Black Beauty",red chestnut,2005,2006
Duchess,751134,"Sierra Palomino Pinto and Diablo Black Wolf With Duchess, Wolf",palomino pinto,2006,
Duchess,755481,Grey Thoroughbred and Dark Grey Thoroughbred Foal With Morgan Foal,light grey,2012,
Duchess,760203,"Deluxe Stable Set With Johar, barn, rider, western tack",palomino,2009,2010
Duchess,1994,BreyerFest Live Auction (1 made),,,
Fairfax,964,Bright Bay Morgan,"bright bay, black points, hind socks",2021,2022
Fairfax,5490,"Spanish Mustang Family With Fairfax, Mariah, Haflinger Foal, fencing, water trough, feed bag, bucket, bag of feed","black, wide blaze down over muzzle",2021,2024
Fairfax,10076,"Wild Mustang Family With Fairfax, Mesteno's Mother, Haflinger Foal",bay roan,2024,
Fairfax,62067,Keep The Peace,"tie-dye rainbow, peace sign on rump, gold accents in mane, gold horn and hooves",2022,
Fairfax,62120,"Fairfax, Morgan 2020 Horse of the Year","silver bay, small star",2020,
Fairfax,2023,"BreyerFest Store Special (2,000 made) Stamped ""BreyerFest 2023"" on belly.",,,
Fairfax,2020,Test pieces given to Mindy Berg (2 made),,,
Fairfax,2025,Breyer Midwest (A few models handed out to volunteers setting up),,,
Ginger,678,American Quarter Horse Mare,grullo,2004,2006
Ginger,2005,"Precious Beauty Foal & Gift Set With Andalusian Foal, neck ribbon",chestnut leopard,1996,1997
Ginger,2404,With Black Beauty,light grey,2004,2005
Ginger,3040,"Black Beauty Family With Black Beauty, Duchess, Merrylegs",chestnut,1980,1993
Ginger,3234,"A Pony for Keeps With Merrylegs, Might Tango, Mustang Stallion",alabaster,1990,1991
Ginger,3346,"Hanoverian Family With Andalusian Foal, Keen",light bay,1992,1993
Ginger,4098,Model Horse Play Set and Tack Activity Set With materials to make your own western saddle and bridle.,palomino with two socks,2008,2009
Ginger,8170,Virgo,"blue-green, gold mane, gold to white tail, darker knees and hocks, gold zodiac symbols on both hips",2015,
Ginger,8901,Ginger With green stable blanket,chestnut,1996,
Ginger,1996,Warehouse Gleanings Same as #3346,,,
Ginger,61008,"Classics Bareback Riding Gift Set With rider, halter, bareback pad",buckskin blanket,2002,2005
Ginger,61012,"Stable Feeding Gift Set With a feed bucket, feed scoop, feedbag, hay bale, hay net, and a bag of oats",mahogany bay pinto,2005,2006
Ginger,61101,"Stevie and Belle Gift Set Saddle Club With doll, English tack, saddle pad","black, no white",2008,2009
Ginger,62004,Pinto Mare and Foal With Andalusian Foal (2005-2006) or Morgan Foal (2007),bay overo,2005,2007
Ginger,62006,Pinto Horse and Foal With Trotting Stock Horse Foal,chestnut tobiano,2008,2009
Ginger,700294,"Spanish-Norman Family With Andalusian Foal, Andalusian Stallion",alabaster,1994,
Ginger,702297,"Pinto Family, Freedom, Independence, and Liberty With Arabian Foal, Black Beauty",grullo pinto,1997,
Ginger,703240,Hatatitla,bay,1990,
Ginger,2008-2009,"Walmart America's Wild Mustangs Series Box reads 750199, list on back reads 750207",,,
Ginger,750212,"Sedona, Sabino Pinto Mare, and Tucson, Bay Foal With American Quarter Horse Foal",bay sabino,2008,
Ginger,750266,"Sonador and Dakota Fanning as Cale Classics Gift Set With halter, lead line and doll",chestnut,2005,2006
Ginger,750601,Grullo Pinto Mare and Red Dun Foal With Mustang Foal,grullo pinto,2003,
Ginger,1997,Toys 'R' Us (unreleased),,,
Haflinger Foal,942,Colorful Foals: bay pinto and chestnut With Warmblood Foal,bay pinto,2011,2014
Haflinger Foal,5490,"Spanish Mustang Family With Fairfax, Mariah, Haflinger Foal, fencing, water trough, feed bag, bucket, bag of feed",sorrel,2021,2024
Haflinger Foal,5582,"Playful Pony Family With American Quarter Horse Stallion, Haflinger Mare","chestnut, stocking on left hind, blaze",2023,
Haflinger Foal,10076,"Wild Mustang Family With Fairfax, Mesteno's Mother, Haflinger Foal",buckskin overo,2024,
Haflinger Foal,61024,"Pet Groomer Includes 6"" articulated doll, Welsh Corgi, Siamese Calico Cat, shampoo bottle, bucket and water trough.",palomino,2014,2017
Haflinger Foal,61098,"Heroes of the West With Standing Thoroughbred, Harper, Haflinger Foal","black, white tip on tail, foreleg stockings",2017,2019
Haflinger Foal,62043,Bay Dartmoor Pony & Light Bay Foal With Haflinger Mare,"light bay, snip, black points, off fore and near high stockings",2014,2016
Haflinger Foal,62200,"Pony Power With Black Beauty, Haflinger Mare, fencing, water trough, feed bucket, bunch of carrots",bay,2019,2020
Haflinger Foal,62224,Effortless Grace With Mariah,chestnut leopard,2023,2025
Haflinger Foal,65001,Bay Dartmoor Pony & Light Bay Foal With Haflinger Mare,"light bay, snip, black points, off fore and near high stockings",2018,
Haflinger Foal,300342,Anna & Tuari Bay Pinto Mare and Black Pinto Colt With Haflinger Mare,"black sabino, bald face, black mane/tail, four stockings",2015,
Haflinger Foal,711133,Hansel & Gretel With Haflinger Mare,,2011,
Haflinger Foal,711911,Bella and Mozart With Haflinger Mare,pearly white,2013,2015
Haflinger Foal,712232,"Fiona and Rory With Haflinger Mare, blanket","black with blue iridescence, black mane/tail, four low stockings",2017,2018
Haflinger Mare,920,Bay Pinto Pony,"bay pinto, bald face, black points, hind stockings",2017,2020
Haflinger Mare,938,Chestnut Haflinger,flaxen chestnut,2011,2016
Haflinger Mare,5582,"Playful Pony Family With Haflinger Foal, American Quarter Horse Stallion","grey, three socks",2023,
Haflinger Mare,62043,Mealy Bay Dartmoor Pony & Light Bay Foal With Haflinger Foal,bay,2014,2016
Haflinger Mare,62200,"Pony Power With Black Beauty, Haflinger Foal, fencing, water trough, feed bucket, bunch of carrots",chestnut,2019,2020
Haflinger Mare,65000,Chestnut Haflinger,flaxen chestnut,2018,
Haflinger Mare,65001,Mealy Bay Dartmoor Pony & Light Bay Foal With Haflinger Foal,bay,2018,
Haflinger Mare,300342,Anna & Tuari Bay Pinto Mare and Black Pinto Colt With Haflinger Foal,"bay sabino, bald face, black mane/tail",2015,
Haflinger Mare,711133,Hansel & Gretel With Haflinger Foal,,2011,
Haflinger Mare,711911,Bella and Mozart With Haflinger Foal.blanket,pearly white,2013,2015
Haflinger Mare,712232,"Fiona and Rory With Haflinger Foal, blanket","black with blue iridescence, black mane/tail, four low stockings",2017,2018
Harper,950,Bay Roan Australian Stock Horse,"bay roan, black points, blaze. hind stockings",2019,2020
Harper,61098,"Heroes of the West With Standing Thoroughbred, Harper, Haflinger Foal","grulla, bald face, darker points",2017,2019
Harper,62053,Day Dreamer,light blue rainbow clearware,2018,2019
Harper,62063,Cora,pink and blue w/ purple interference w/ scales on rump,2022,
Harper,62116,Harper 2016 Horse of the Year,"bay tobiano, broken blaze, black and white mane, white tail, four high stockings",2016,
Harper,62116,Glossy Harper,"glossy bay tobiano, broken blaze, black and white mane, white tail, four high stockings",2017,
Harper,62301,"Birthday at the Barn With Warmblood Foal, doll, Cantering TB Mare","palomino, star, white and flaxen mane/tail",2020,
Harper,97267,Serendipity Magical Unicorn,pale blue,2018,
Harper,300362,Sandy Bay Mustang Mare and Grullo Foal With Harper and Trotting Stock Horse Foal,"buckskin, blaze, snip, black points, hind stockings",2018,
Harper,301175,"Desert Paint Family With Harper, Black Stallion and Morgan Foal",chestnut w/ blaze,2022,
Harper,712230,Goblin,glow in the dark with purple points and decorator goblins,2017,
Harper,712517,Wintergreen,"green/clear clearware, painted with pearly white forest motifs and clear swirls of plastic",2023,
Harper,712520,Breyer Kid's Club Deluxe Membership,grey,2023,2024
Harper,2024-2025,Elements Collection,,,
Hobo,625,Hobo the Mustang of Lazy Heart Ranch,buckskin,1975,1980
Hobo,2085,"Hobo Gift Set With paperback book, Mustang, Wild Spirit of the West",buckskin,1975,1981
Hobo,3362,The Pony Express - Legends of the West,buckskin,2001,
Hobo,410493,Nevada Star,silvery grey,1993,
Hobo,703595,"Riddle Passing Through Time, Phase I",bay blanket,1995,
Hobo,703595,"Riddle Passing Through Time, Phase II",chestnut leopard,1995,
Hobo,703595,"Riddle Passing Through Time, Phase III",black/brown leopard,1995,
Hobo,711995,Mischief Night,"pearl and green Halloween deco, glows in the dark",2014,
Hobo,1997,BreyerFest Live Auction (1 made)With Certificate of Authenticity,,,
Hollywood Dun It,478,Hollywood Dun It,dun,1998,2004
Hollywood Dun It,1203,Dun Gotta Gun,"dun, dorsal stripe, black points, three socks",2003,2004
Hollywood Dun It,1766,NRHA 50th Anniversary Model (National Reining Horse Association),"chestnut, no white markings",2016,
Hollywood Dun It,9127,"Horse and Rider Gift Set - Reining With western tack, rider",palomino,2010,
Hollywood Dun It,701602,Gunner,chestnut pinto,2002,
Hollywood Dun It,712392,Slyder,glossy dark dappled grey w/ pearly mane and tail,2021,
Hollywood Dun It,712392,Slyder,glossy sooty buckskin blanket appaloosa w/ two socks,2021,
Hollywood Dun It,712392,Slyder,glossy flaxen liver chestnut splash pinto w/ blue eyes,2021,
Hollywood Dun It,400340,Chestnut Reiner,"chestnut w/ diamond, sock, dark mane and tail",2022,
Hollywood Dun It,2025,"BreyerFest Limited Edition (1,750 made) ""BreyerFest 2025"" stamped on belly",,,
Jet Run,634,Palomino Warmblood,"palomino, shaded muzzle, white mane/tail, hind stockings, faint fore stockings",1998,
Jet Run,644,Dark Red Chestnut Thoroughbred,"dark chestnut, darker mane/tail, near hind sock",1999,2000
Jet Run,653,Black Tobiano Pinto,"black tobiano, black and white mane, white tail, four high stockings",2001,2006
Jet Run,685,Sport Horse,"grullo, chocolate brown points and lower face, leg barring, near hind sock",2006,2008
Jet Run,960,Pearly Grey Trakehner,pearly grey,2021,2022
Jet Run,3035,"U.S. Equestrian Team Gift Set - ""Jet Run"" With Keen, Might Tango","bay, star, black points",1980,1993
Jet Run,3347,"Trakehner Family With Duchess, Mustang Foal","dark chestnut, star, lighter chestnut mane/tail, off hind stocking",1992,1994
Jet Run,6171,Aristocrat with Canterwood Crest: Chasing Blue Includes Chasing Blue paperback novel by Jessica Burkhart. Some autographed by author.,"chestnut, blaze, snip, darker chestnut mane/tail",2014,2016
Jet Run,8937,Rembrandt,"reddish bay, solid face, black points, near hind sock",1996,1997
Jet Run,19843,"Family to Church on Sunday With Duchess, surrey and harness, ceramic dolls, wood base and clear display case","flocked bay, blaze, black haired mane/tail, three socks, not off hind",1984,1987
Jet Run,61084,"New Arrival at the Barn - Deluxe Horse & Foal Set Includes Jet Run and Trotting Stock Horse Foal, 6"" articulated doll, halter, foal blanket, fencing, rake, shovel, bucket and water trough.","red bay, star, dark brown or black points,",2014,2016
Jet Run,61114,Classics English Horse & Rider,"bay roan, black points, near hind stocking",2017,2023
Jet Run,62033,Blood Bay Warmblood and Liver Chestnut Foal With Trotting Stock Horse Foal,"blood bay, black points, three stockings, not off hind",2010,2013
Jet Run,493035,"U.S. Olympic Team With Keen, Might Tango","light chestnut, blaze, darker chestnut mane/tail, fore stockings",1987,
Jet Run,703235,"German Olympic Set (Rembrandt) With Keen, Might Tango","reddish bay, solid face, black points, near hind sock",1989,1990
Jet Run,720036,"Let's Have a Picnic With doll, picnic accessories, Jack Russell Terrier","grey leopard, grey-brown mane, grey and white tail, off hind stocking",2006,
Jet Run,720600,"A Day at the Beach With model, doll, blanket, beach towel, bucket, ball","bay, black points, near for and off hind socks",2009,
Jet Run,755483,Blood Bay Warmblood and Liver Chestnut Foal With Trotting Stock Horse Foal,"blood bay, black points, three stockings, not off hind",2012,
Jet Run,1993,BreyerFest Live Auction (1 made),,,
Jet Run,1994,BreyerFest Live Auction (1 made),,,
Johar,614,Grey Pinto,grey pinto,2009,2011
Johar,647,Bay Arabian,"bay, stripe, black points, three low stockings, not near hind",1999,2000
Johar,656,Arabian Mare,rose grey,2001,2006
Johar,657,Lusitano Replaced Andalusian Mare,golden chestnut,2006,
Johar,937,Chestnut Appaloosa,chestnut blanket,2011,2016
Johar,3030,"The Black Stallion Returns Set With Black Stallion, Sagr",alabaster,1983,1993
Johar,6139,Samirah's Ride Includes paperback version of Samirah's Ride.,dark bay,2010,2013
Johar,8152,Violet,purple violets,2012,
Johar,8156,Rose,red roses,2012,
Johar,8159,Aster,yellow asters,2012,
Johar,8160,Calendula,orange calendulas,2012,
Johar,9159,Johar,red chestnut,2014,
Johar,19841,Drive on a Sunny Day,flocked chestnut,1984,1987
Johar,61011,"English Riding Gift Set With doll, English saddle and bridle",palomino,2005,2006
Johar,61087,"A Champion is Born - Three Horse Arabian Set With Black Stallion, Johar, American Quarter Horse Foal","grey, dark grey/black points, three socks, not off fore",2015,2016
Johar,62003,Arabian Mare and Foal With American Quarter Horse Foal,red roan,2006,2007
Johar,62032,Black Blanket Appaloosa and Leopard Appaloosa Foal With American Quarter Horse Foal,black blanket,2010,2013
Johar,403755,"Foal's First Day With Arabian Foal, two gallon metal pail",rose grey,1988,
Johar,413550,Foal's First Day With Arabian Foal,"rose grey, shaded knees",1988,
Johar,700693,"Drinkers of the Wind With Arabian Foal, Arabian Stallion",fleabitten grey,1993,
Johar,701728,"Visiting Vet Gift Set With American Quarter Horse Foal, Calico Cat, Silver Tabby, Beagle","black blanket, black mane/tail, hind stockings, off foreleg stockings",2014,2015
Johar,705095,"Eagle and Pow Wow With doll, halter, blanket",black pinto,1995,
Johar,720034,"Let's Visit Baby With Mesteño's Foal, doll",bay,2007,
Johar,720100,Buckskin Lusitano Mare Replaced Andalusian Mare,"buckskin, three stockings and blaze",2007,2008
Johar,750502,Dapple Grey Mare and Bay Foal With Quarter Horse Foal,"light dappled grey, white mane/tail",2003,
Johar,755406,"New Arrival at the Barn With Mesteño the Foal, Silver Tabby",buckskin,2012,2013
Johar,755453,Grey & White Pinto Sunshine Stables,grey pinto,2012,2013
Johar,755482,Black Blanket Appaloosa and Leopard Appaloosa Foal Sunshine Stables With American Quarter Horse Foal,black blanket,2012,2013
Johar,760203,"Deluxe Stable Set With Duchess, barn, rider, western tack",chestnut pinto,2009,2010
Johar,1993,BreyerFest Live Auction (1 made),,,
Johar,1997,Toys R Us,,,
Johar,2012,Pottery Barn Kids Appears to be same as #937,,,
Keen,615,Chestnut Thoroughbred,dappled chestnut,2009,2011
Keen,632,Liver Chestnut Appaloosa Sporthorse,liver chestnut blanket,1998,
Keen,639,Classics Horse and Jump Set With yellow/white panel jump,dark brown bay,1998,
Keen,642,Dapple Grey Hanoverian,dappled grey,1999,2000
